{
  "schema_version": 1,
  "id": "vanilla",
  "version": "1.0.0",
  "type": "layout",
  "render_context_api_version": "1",
  "runtime": ">=0.1.0,<0.2.0",
  "templates": {
    "doc": "views/doc.html",
    "doc_list": "views/doc_list.html",
    "collection": "views/collection.html",
    "changelog": "views/changelog.html",
    "api_reference": "views/api_reference.html",
    "page": "views/page.html",
    "home": "views/home.html",
    "portal": "views/portal.html"
  },
  "assets": [
    {"role": "styles", "path": "vanilla.css"}
  ],
  "capabilities": ["templates", "styles"],
  "requires_trust": [],
  "contract": {
    "render_modes": ["full", "fragment"],
    "slots": ["head", "scripts", "shell", "content"],
    "semantic_hooks": ["main", "page-root"],
    "component_api": "chirp-ui@0.11"
  }
}
